STATE,ORIG_LABEL,MAP_SYM1,MAP_SYM2,UNIT_LINK,PROV_NO,PROVINCE,UNIT_NAME,UNIT_AGE,UNITDESC,STRAT_UNIT,UNIT_COM,MAP_REF,ROCKTYPE1,ROCKTYPE2,ROCKTYPE3,UNIT_REF
VA,DSu,DSu,DSu;0,VADSu;0,0,,"Ridgeley Sandstone, Helderberg and Cayugan Groups",Silurian-Devonian,"Ridgeley Sandstone, Helderberg and Cayugan Groups - Calcareous sandstone; partly cherty limestone; calcareous shale; fossiliferous.",,"Appalachian Plateaus and Valley and Ridge.From expanded explanation (ref. VA002):Ridgeley Sandstone and Helderberg and Cayuga Groups.Ridgeley Sand stone (Swartz, 1913). Sandstone, gray, fine-to coarse-grained, locally conglomeratic, weathers yellowish- to dark-yellowish-brown, friable, calcareous, andfossiliferous. Thickness ranges up to 150 feet but is highly variable locally; occurs in western Virginia north of Craig County. Same as the Oriskany Sandstone of Butts (1933), and is continuous with the Rocky Gap Sandstone to the southwest. It grades downward into the Licking Creek Limestone and has been extensively mined for iron ore (Lesure, 1957).Helderberg Group.Licking Creek Limestone (Swartz, 1929). Upper member is light-gray, coarse-grained, arenaceous limestone; lower member is medium-to dark-gray, fine-grained, chertbearing limestone. Thickness ranges from 0 to150 feet and is present northeastward from Craig County; same as the Becraft (upper member) and New Scotland (lower member) of Butts (1940). It conformably over lies the Heal ng Springs Sandstone where the sandstone is present. It was extensively mined for iron with the Ridgeley Sandstone.Healing Springs Sandstone (Swartz, 1929). Sandstone, light-gray, medium- to coarse-grained, cross-laminated, and calcareous with local lenses of chert. Present in Alleghany, Bath, and Augusta Counties where it is generally less than 20 feet thick and conformably overlies the New Creek Lime stone. It appears to be a northeast extending tongue of Rocky Gap Sandstone.New Creek Limestone (Bowen, 1967; Coeymans Limestone of earlier reports). Limestone, light- to-medium gray with pink calcite crystals, very-coarse-grained, crinoidal, with lenses of quartz sandstone locally in the lower part. Occurs as local reefoidal buildups northeast of Alleghany County. Keyser Formation (Swartz, 1913). Limestone, sandstone, and shale. Limestone (upper), medium- to dark-gray, fine- to medium-grained, nodular, scattered, small chert nodules, biohermal, fossiliferous. Limestone (lower), medium- to dark-gray, fine- to coarse-grained, medium- to thick-bedded, very nodular, shaly, with thin (1- to 3-inch thick) crinoidallayers. Sandstone, medium-light-gray, medium-grained, calcareous, cross-bedded. Shale, medium-gray, calcareous. Upper and lower boundaries are conformable north of CliftonForge. Thickness ranges from 250 feet in Highland County to 50 feet in Augusta County.In Highland and Bath counties the upper and lower limestones are separated by a calcareous shale unit (Big Mountain Shale Member). To the south and southeast the shale is replaced by sandstone (Clifton Forge Sandstone Member). From Craig County southwestward, the Keyser becomes all sandstone and is equivalent to the lower portion of the Rocky Gap Sandstone. Southwest of Newcastle the lower contact is disconformable. For mapping purposes the Keyser is considered to be partof the Helderberg Group.Cayuga Group.Tonoloway Limestone (Ulrich, 1911). Limestone, very-dark-gray, fine-grained, thin-bedded to laminated, with some arenaceous beds; celestite locally occurs in vugs and as veins. Thickness ranges from a few feet in southwestern Virginia to more than 500 feet in Highland County. It is conformable with the underlying Wills Creek Formation and equivalent to the Hancock Formation of Southwest Virginia.Wills Creek Formation (Uhler, 1905). Limestone, medium-to dark-gray, fine-grained, arenaceous, thin-bedded, with calcareous shale and mudstone, and thin, quartzose sandstone beds. Occurs only in western Virginia where the thickness ranges from 0 to more than 400 feet. It conformably over lies the Bloomsburg Formation and is laterally equivalent to the upper part of the Keefer Sandstone to the east and southwestof Craig County where the typical Wills Creek lithology is absent.Bloomsburg Formation (White, 1893). Sandstone, reddish-gray, fine-grained, thick-bedded with red mudstone interbeds. Thickness ranges from 35 to 400 feet betweenFrederick County and the northern Massanutten Mountains respectively. It grades into the Wills Creek Formation to the southwest, and is probably equivalent, in part, to the Keefer Sandstone southwest of Craig and Botetourt counties. McKenzie Formation (Stose and Swartz, 1912).Shale, medium-gray, yellowish weathering and interbedded sandstone, medium-gray, medium-grained, friable, thin-bedded and calcareous. Thickens northeastward from a few feet in Bath County to about 200 feet in Frederick County. It is probably equivalent in part to the Keefer Sandstone to the southwest and southeast and appears to be conformable with the Keefer Sandstone in northwestern Virginia.",VA003,limestone,sandstone,shale,VA001 VA002VA003
VA,DSz,DSz,DSz;0,VADSz;0,0,,Lower Devonian and Silurian Formations Undivided,Silurian-Devonian,"Lower Devonian and Silurian Formations Undivided - Some landslides with intact stratigraphic units in Craig County area.  Includes: Dsu, Skrt, Sm. (Shrc?)",,Undivided; Appalachian Plateaus and Valley and Ridge,VA003,sandstone,limestone,shale,VA001 VA003
VA,Dx,Dx,Dx;0,VADx;0,0,,"Millboro Shale, Huntersville Chert, and Rocky Gap Sandstone",Devonian,"Millboro Shale, Huntersville Chert, and Rocky Gap Sandstone - Black, fissile shale; chert; and calcareous sandstone",,"Appalachian Plateaus and Valley and Ridge.From expanded explanation (ref. VA002):Millboro Shale, Huntersville Chert, and Rocky Gap Sandstone.Millboro Shale. Refer to previous description under Dmn.Huntersville Chert (Price, 1929). Chert, white, thin-bedded, iron-stained, blocky, fossiliferous with cherty, glauconitic sandstone and greenish-gray shale. The Huntersville Chert ranges from 10 to 60 feet in thickness (Bartlett and Webb, 1971). Butts (1940, p. 303) states, ""The Onondaga [Huntersville Chert] persists to Mendota, Washington County, but 10 miles farther southwest.... it is absent in a fully exposed section"". The Huntersville correlates with the Needmore Formation to the northeast and the upper part of the Wildcat Valley Sandstone in Lee County. Rocky Gap Sandstone (Swartz, 1929). Sandstone, medium- to light-gray, weathers dark-yellowish-orange, coarse-grained, scattered, thin, quartz-pebble conglomerate beds, arenaceous chert in upper ten feet, calcite cement, friable when weathered. Thickness ranges from 0 near McCall Gap, Washington County to about 85 feet in Bland and Giles counties.Equivalent in part to the Wildcat Valley Sandstone of Lee County and the Ridgeley (Oriskany) Sandstone and Helderberg Group north of Craig County. The lower contactis disconformable. The upper contact with the Huntersville Chert appears to be conformable.",VA003,black shale,chert,sandstone,VA001 VA003
VA,fbgr,fbgr,fbgr;0,VAfbgr;0,0,,Foliated Biotite Granite,Proterozoic,Foliated biotite granite,,"Central Virginia Volcanic-Plutonic BeltFrom expanded explanation (ref. VA002):Foliated biotite granite. Leucocratic to mesocratic, medium-grained, equigranular, crudely-layered; includes hornblende-biotite granite and, monzogranite. Geophysical signature: strong positive radiometric signature; negative magnetic signature.",VA003,granite,,,VA001VA002 VA003
VA,fcm,fcm,fcm;0,VAfcm;0,0,,Fine Creek Mills Granite,Proterozoic,Fine Creek Mills granite - Granite,,"Eastern PiedmontFrom expanded explanation (ref. VA002):Fine Creek Mills granite (Poland, 1976; Reilly, 1980). Light-gray, medium- to coarse-grained, homogenous, foliated, flow-banded granite. Mineralogy: microcline + plagioclase + quartz + biotite; accessory minerals include apatite, garnet, fluorite, and zircon. The Fine Creek Mills intrudes the State Farm Gneiss (Ysf).",VA003,granite,,,VA001 VA002VA003
VA,fg,fg,fg;0,VAfg;0,0,,Gneissic Granite and Granodiorite,Proterozoic,Gneissic granite and granodiorite,,"Southeastern PiedmontFrom expanded explanation (ref. VA002):Gneissic granite and granodiorite. Light-gray to white, fine- to medium-grained, massive to foliated, muscovite-biotite gneissic granite to granodiorite containing minor garnet, andxenoliths of biotite gneiss and amphibolite. Several different intrusive phases are present.",VA003,granite,granodiorite,,VA001 VA002VA003
VA,fgb,fgb,fgb;0,VAfgb;0,0,,Biotite Granite Gneiss,Proterozoic,Biotite granite gneiss,,"Central PiedmontFrom expanded explanation (ref. VA002):Biotite granite gneiss. Light-gray, medium-grained, equigranular, broadly-layered, locally migmatitic. Mineralogy: quartz + plagioclase + microcline + biotite + muscovite + hornblende; apatite and zircon are accessory minerals. Geophysical signature: diffuse pattern of positive radiometric anomalies.",VA003,granitic gneiss,,,VA001 VA002VA003
VA,fr,fr,fr;0,VAfr;0,0,,Flat Rock Granite,Proterozoic,Flat Rock granite - Granite,,"Eastern PiedmontFrom expanded explanation (ref. VA002):Flat Rock granite (Reilly, 1980). Light-gray, medium to coarse-grained, homogenous, foliated granite. Mineralogy: microcline + plagioclase + quartz + biotite; accessory minerals include garnet, apatite, fluorite, and zircon. The Flat Rock intrudes the State Farm Gneiss (Ysf).",VA003,granite,,,VA001VA002 VA003
VA,g,g,g;0,VAg;0,0,,Granite,Proterozoic,Granite,,"Southeastern PiedmontFrom expanded explanation (ref. VA002):Granite. Light-gray to pink, fine- to medium-grained granite and granodiorite; zoned plagioclase crystals with epidotized and saussuritized cores are characteristic. Thegranite contains xenoliths of mafic volcanic rocks near its margins. The granite intrudes volcanic rocks east of the Hollister fault zone southeast of Petersburg. Samples from the quarry at Skippers were dated by Rb-Sr whole-rock methods (Bottino and Fullagar, 1968); these data show considerable scatter, implying age of crystallization ranging from 460 Ma to as old as 690 Ma. This unit was shown as Petersburg Granite on the 1963 Geologic Map of Virginia, but field relations, petrology, and the apparent age indicate that it is a separate pluton.",VA003,granite,granodiorite,,VA001 VA002VA003
VA,ga,ga,ga;0,VAga;0,0,,Hornblende-plagioclase Gabbro,Proterozoic,"Hornblende Gabbro in Carolina Slate Belt; Hornblende-Plagioclase Gabbro in Central Virginia Volcanic-Plutonic Belt; Gabbro, Hornblendite and Norite in Central Piedmont",,"Carolina Slate Belt; Central Virginia Volcanic-Plutonic Belt; Central Piedmont.From expanded explanation (ref. VA002):Hornblende-plagioclase gabbro. Dark-grayish-green, coarse- to medium-grained, massive to foliated metagabbro. Mineralogy: amphibole + plagioclase + clinopyroxene + quartz + biotite + muscovite + epidote ñ magnetite. Geophysical signature: small circular positive magnetic anomalies. Plutons of these gabbros intrude interlayered mafic and felsic metavolcanic rocks.",VA003,gabbro,norite,,VA003VA002
VA,gn,gn,gn;0,VAgn;0,0,,Gneiss,Proterozoic,Gneiss as exotic blocks within melange units,,Western Piedmont,VA003,gneiss,,,VA001 VA003
VA,gns,gns,gns;0,VAgns;0,0,,Gneiss and Schist,Proterozoic,Gneiss and schist.,,"Southeastern PiedmontFrom expanded explanation (ref. VA002):Gneiss and schist. Includes graphite schist; garnet staurolite- biotite-sericite schist containing kyanite, sillimanite, and less commonly muscovite; garnet-biotite gneiss; biotite muscovite gneiss; phyllonite; and, mylonitic to ultramylonitic garnet-muscovite-biotite gneiss. This unit may correlate with biotite gneiss and schist (rbg), and with Raleigh belt rocks of North Carolina (Geologic Map of North Carolina, 1985; Stoddard and others, 1991 and references therein).",VA003,gneiss,schist,,VA001 VA002VA003
VA,gr,gr,gr;0,VAgr;0,0,,Granitoid Rocks,Proterozoic,Granitoid blocks as exotic blocks within melange units,,Western Piedmont,VA003,granitoid,,,VA001 VA003
VA,grb,grb,grb;0,VAgrb;0,0,,Biotite Granite,Proterozoic,Biotite granite,,"Central Virginia Volcanic-Plutonic BeltFrom expanded explanation (ref. VA002):Biotite granite. Gray to white, medium-grained, massive to layered granite and granite gneiss range in composition from granite to quartz diorite. Quartz diorite dikes and sillsare locally abundant. Mineralogy: quartz + potassium feldspar + plagioclase + biotite + epidote + muscovite ñ clinopyroxene + hornblende. This unit intrudes biotite gneiss unit (Cbg).",VA003,granite,,,VA001VA002 VA003
VA,grbi,grbi,grbi;0,VAgrbi;0,0,,Biotite Granite,Proterozoic,Biotite granite,,"Carolina Slate Belt.From expanded explanation (ref. VA002):Biotite granite. Light-gray, medium-grained, equigranular, broadly-layered, locally migmatitic, foliated. Mineralogy: quartz + plagioclase + microcline + biotite + muscovite ñ hornblende + apatite + zircon.	",VA003,granite,,,VA001 VA002VA003
VA,grc,grc,grc;0,VAgrc;0,0,,Carysbrook Pluton,Proterozoic,Carysbrook pluton - Granite.,,"Central Virginia Volcanic-Plutonic BeltFrom expanded explanation (ref. VA002):Carysbrook pluton. Light-gray, medium- to coarse grained, massive to indistinctly foliated biotite granite. Mineralogy: quartz + potassium feldspar + plagioclase + biotite + chlorite + muscovite + epidote. Geophysical signature: diffuse pattern of elevated radiometric anomalies. Although Smith and others (1964) included the Carysbrook pluton in a granodiorite unit with granitoid rocks in the vicinity of Columbia, Stose and Stose (1948) recognized that the granite at Carysbrook was different in texture andcomposition from the granodiorite at Columbia. Our mapping affirms that these are separate plutons. The Carysbrook is unconformably overlain by the Arvonia Formation; this relation is well-exposed in an abandoned railroad cut south of Carysbrook (Smith and others, 1964). The pluton intrudes the Chopawamsic Formation.",VA003,granite,,,VA001 VA002VA003
VA,grp,grp,grp;0,VAgrp;0,0,,Porphyritic Granite,Proterozoic,Porphyritic granite,,"Carolina Slate BeltFrom expanded explanation (ref. VA002):Porphyritic granite. Light-gray to pink, medium to coarse-grained, coarse granular texture common; locally pegmatitic. Mineralogy: quartz + porphyroblastic microcline + biotite + muscovite ñ epidote ñ titanite ñ opaque minerals.",VA003,granite,,,VA001VA002 VA003
VA,grpo,grpo,grpo;0,VAgrpo;0,0,,Porphyritic Granite,Proterozoic,Porphyritic granite,,"Central PiedmontFrom expanded explanation (ref. VA002):Porphyritic granite. Pink to white, medium- to very coarse- grained; mineralogy includes quartz, microcline porphyroblasts, plagioclase, muscovite, and minor biotite. This rock intrudes migmatitic paragneiss (mpg) southeast of Farmville Mesozoic basin.",VA003,granite,,,VA001 VA002VA003
VA,grt,grt,grt;0,VAgrt;0,0,,Metatonalite,Proterozoic,Metatonalite,,"Carolina Slate BeltFrom expanded explanation (ref. VA002):Metatonalite. White to light-gray, medium- to coarse-grained, faintly foliated, locally porphyritic; ranges from granodiorite to quartz diorite. Mineralogy: quartz + plagioclase + biotite + microcline. This unit includes the Vance pluton of Horton and others (1993), dated at 571ñ17 Ma (U-Pb zircon; LeHuray, 1989).",VA003,tonalite,granodiorite,quartz diorite,VA001 VA002VA003
VA,gs,gs,gs;0,VAgs;0,0,,Actinolite Schist Metabasalt,Proterozoic,Actinolite schist metabasalt,,"Western Piedmont, Southwest and Central.From expanded explanation (ref. VA002):Actinolite schist metabasalt. Dark-green, variably schistose chlorite-actinolite-epidote greenstone metabasalt, amygdaloidal in part; massive yellowish-green epidosite segregations common.",VA003,meta-basalt,,,VA001 VA002VA003
VA,Jb,Jb,Jb;0,VAJb;0,0,,Newark Supergroup; Jurassic Basalt,Lower Jurassic,basalt,,"Newark Supergroup; Mesozoic BasinsFrom expanded explanation (ref. VA002):Basalt . Fine- to medium-crystalline, equigranular, porphyritic, vesicular, or amygdaloidal; medium- to dark-gray subophitic intergrowths of plagioclase laths and clinopyroxene with amygdules of calcite, zeolites, and prehnite. Occurs only in the Culpeper basin as three principle basalt flows separated by sedimentary rocks.",VA003,basalt,,,VA001VA002 VA003
VA,Jc,Jc,Jc;0,VAJc;0,0,,Newark Supergroup; Jurassic Conglomerate,Lower Jurassic,Conglomerate,,"Newark Supergroup; Mesozoic BasinsFrom expanded explanation (ref. VA002):Conglomerate. Rounded pebbles, cobbles, and boulders of quartz, gneiss, schist, basalt, minor greenstone, and marble in a matrix of medium- to very-coarse-grained, reddish-brown to light-gray sandstone. Occurs only in the Culpeper basin.",VA003,conglomerate,,,VA001 VA002VA003
VA,Jd,Jd,Jd;0,VAJd;0,0,,Diabase,Jurassic,Diabase,,"Coastal Plain.From expanded explanation (ref. VA002):Diabase (Lower Jurassic). Fine- to coarsely-crystalline, subaphanitic or porphyritic with aphanitic margins; dark-gray mosaic of plagioclase laths and clinopyroxene, with somemasses characterized by olivine or bronzite, others granophyric. Also occurs as dikes and sills in the Valley and Ridge, Piedmont, and Blue Ridge physiographic provinces.",VA003,diabase,,,VA001VA002 VA003
VA,Jsh,Jsh,Jsh;0,VAJsh;0,0,,Newark Supergroup; Jurassic Siltstone and Shale,Jurassic,Interbedded siltstone and shale,,"Newark Supergroup; Mesozoic BasinsFrom expanded explanation (ref. VA002):Siltstone and shale. Interbedded reddish-brown siltstone and reddish-brown, greenish-gray, dark-gray, fossiliferous shale. Occurs only in the Culpeper basin.	",VA003,shale,siltstone,,VA001 VA002VA003
VA,Jss,Jss,Jss;0,VAJss;0,0,,Newark Supergroup; Jurassic Interbedded Sandstone and Siltstone,Lower Jurassic,Interbedded sandstone and siltstone,,"Newark Supergroup; Mesozoic BasinsFrom expanded explanation (ref. VA002):Sandstone and siltstone. Interbedded fine- to coarse grained, pebbly, reddish-brown, and arkosic sandstone and reddish-brown siltstone; rhythmically interbedded with siltstone and shale unit (sh). Occurs only in the Culpeper basin.",VA003,sandstone,siltstone,,VA001 VA002VA003
VA,basalt,JTbasalt,JTbasalt;0,VAJTbasalt;0,0,,Valley and Ridge Igneous Intrusions; Basalt,Jurassic-Tertiary,"Valley and Ridge Igneous Intrusions; b: Basalt - Dikes in Augusta and Rockingham Counties: nepheline syenite, teschenite-syenite, and teschenite-picrite.  Igneous bodies in Highland County: andesite and basalt.",,"Appalachian Plateaus and Valley and RidgeFrom expanded explanation (ref. VA002):Basalt (Mole Hill, Rockingham County, Brent, 1960), labradorite, augite, olivine, magnetite, serpentine, chlorite, dolomite, epidote(?). Radiometric age: 47ñ 1 Ma (Eocene, Wampler and Dooley, 1975). Dikes in Highland and adjacent counties are of three types: Mafic rocks, felsic rocks, and breccia. Mafic rocks are dark gray to black and range from aphanitic to porphyritic in texture. Phenocrysts include plagioclase, clinopyroxene and,occasionally, olivine and biotite. Amygdules may be present, and xenoliths of country rock are common. Felsic rocks are mineralogically variable and texturally complex.They are light to medium-gray when fresh and are generally porphyritic with phenocrysts of plagioclase, biotite, hornblende, orthopyroxene, and orthoclase. Breccia (or ""diatreme"") contain abundant xenoliths of older igneous rock, sedimentary county rock, and xenocrysts of various minerals. Radiometric dates for some of the intrusive rocks are Eocene in age (Fuller and Bottino, 1969). Field relationships of other bodies suggest Mesozoic emplacement. Alkalic intrusive rocks, including nepheline-syenite, teschenite-syenite, and teschenite-picrite occur in Augusta County (Rader, 1967).Diabase dikes occur in several counties and are shown in red on the map.",VA003,basalt,andesite,,VA001VA002 VA003
VA,p,JTp,JTp;0,VAJTp;0,0,,Valley and Ridge Igneous Intrusions; Peridotite,Jurassic-Tertiary,"Valley and Ridge Igneous Intrusions; p: Peridotite - Dikes in Augusta and Rockingham Counties: nepheline syenite, teschenite-syenite, and teschenite-picrite.  Igneous bodies in Highland County: andesite and basalt.",,"Appalachian Plateaus and Valley and Ridge. From expanded explanation (ref. VA002):Peridotite (Warren County, Rader and Biggs, 1976), chlorite, phlogopite, hydrobiotite pseudomorphs after olivine and pyroxene, pyrite, perovskite partly altered to leucoxene, apatite, dolomite, ilmenite, magnetite, epidote, and garnet. Kimberlite (Rockbridge County, Sears and Gilbert, 1973; Spencer, 1968), altered matrix montmorillonite, vermiculite, and chlorite; separated crystals Cr-rich spinel, clinopyroxene, garnet, ilmenite, rutile, anatase, zircon, and amphibole.",VA003,peridotite,syenite,,VA001 VA002VA003
VA,Kp,Kp,Kp;0,VAKp;0,0,,Potomac Formation,Cretaceous,"Potomac Formation - Pebbly, poorly sorted quartzo-feldspathic sand interbedded with sandy clay and silt; minor organic-rich clay and silt",,"Coastal PlainFrom expanded explanation (ref. VA002):Potomac Formation (Lower and Upper(?) Cretaceous, McGee, 1886). Light-gray to pinkish- and greenish-gray quartzo-feldspathic sand, fine- to coarse-grained, pebbly, poorly sorted, commonly thick-bedded and trough cross-bedded. Sand is interbedded with gray to green, massive to thick-bedded sandy clay and silt, commonly mottled red or reddish-brown. Includes lesser amounts of clay-clast conglomerate and thin-beddedto laminated, carbonaceous clay and silt. In the inner Coastal Plain, unit was deposited mainly in fluvial-deltaic environments, intertongues eastward with thin glauconitic sands of shallow-shelf origin. Spore and pollen assemblages and leaf impressions of ferns and cycads indicate an Early Cretaceous age (Doyle and Robbins, 1977). In some downdipareas, uppermost part of unit may be of earliest Late Cretaceous age. Thickness ranges from a feather-edge at western limit of outcrop to more than 3500 feet in subsurface ofoutermost Coastal Plain.",VA003,sand,clay or mud,silt,VA001VA002 VA003
VA,ks,ks,ks;0,VAks;0,0,,Kyanite Schist,Proterozoic,Kyanite schist,,"Central PiedmontFrom expanded explanation (ref. VA002):Kyanite schist. Light-gray to grayish-brown, medium to coarse-grained, kyanite-quartz schist. Mineralogy: quartz + kyanite + muscovite; accessory minerals include fuchsite, pyrite, rutile, and graphite.",VA003,schist,,,VA001VA002 VA003
VA,lgn,lgn,lgn;0,VAlgn;0,0,,Lineated Biotite Granite Gneiss,Proterozoic,Lineated biotite granite gneiss,,"Central Virginia Volcanic-Plutonic BeltFrom expanded explanation (ref. VA002):Lineated biotite granite gneiss. Dominantly leucocratic to mesocratic, medium- to coarse-grained, strongly-lineated granite gneiss; includes porphyritic granite gneiss. Mineralogy: quartz + potassium feldspar + plagioclase + biotite + muscovite ñ garnet.Geophysical signature: western portion coincides with strong positive radiometric anomaly. This unit likely includes more than one intrusive body; portions may be derivative of felsic volcanogenic rocks. These rocks intrude and are interlayered with metavolcanic rocks of probable Cambrian age. The unit includes granite gneiss of Nelson (1992), and may be correlative in part with the Shelton Formation (Ost).",VA003,granitic gneiss,,,VA001 VA002VA003
VA,ls,ls,ls;0,VAls;0,0,,Candler Formation - Lmestone,Cambrian,Candler Formation - Limestone.,,"Blue Ridge Anticlinorium, CentralFrom exapnded explanation (ref. VA002):Limestone. Medium-bluish-gray, thinly-laminated limestone and laminated calcareous mudstone; resembles Everona Limestone.",VA003,limestone,mudstone,,VA001 VA002VA003
VA,m,m,m;0,VAm;0,0,,Marsh and Intertidal Mud Deposits,Quaternary,Marsh and Intertidal Mud Deposits - Organic-rich clay and silt,,"Coastal PlainHolocene (Karen Hostettler)From expanded explanation (ref. VA002):Marsh and intertidal mud deposits (Holocene). Medium to dark-gray soft mud, and grayish-brown peat, comprising sediment of marshes in coastal areas and Chesapeake Bay; thickness is 0 to 10 feet. Also, sandy mud and muddy fine sand, light- to dark-gray. Locally, contains abundant shell material characterized by Crassostrea virginica and Mercenaria mercenaria. Comprises sediments of shallow bays and flats in area of Atlantic coastal lagoons of the Eastern Shore.",VA003,clay or mud,silt,,VA001VA002 VA003
