STATE,ORIG_LABEL,MAP_SYM1,MAP_SYM2,UNIT_LINK,PROV_NO,PROVINCE,UNIT_NAME,UNIT_AGE,UNITDESC,STRAT_UNIT,UNIT_COM,MAP_REF,ROCKTYPE1,ROCKTYPE2,ROCKTYPE3,UNIT_REF
VA,O[u,OCAu,OCAu;0,VAOCAu;0,0,,Metasedimentary Rocks Undivided,Cambrian-Ordovician,Metasedimentary rocks,,"Undivided; Western Piedmont, Northern.From expanded explanation (ref. VA002):Metasedimentary rocks, undivided (Pavlides, 1990). Gray to green phyllite, gray to white metasiltstone and fine grained quartzite, fine-grained mica schist, green slate andphyllite, and sparse granule quartzite and graywacke; may be coeval in part with Old Mill Branch Metasiltstone Member of the Popes Head Formation (OCpo).",VA003,metasedimentary rock,quartzite,schist; phyllite; ,VA001VA002 VA003
VA,O[z,OCAz,OCAz;0,VAOCAz;0,0,,Lower Ordovician and Upper Cambrian Formations Undivided,Cambrian-Ordovician,"Lower Ordovician and Upper Cambrian Formations Undivided - Includes Pinesburg Station Dolomite, Rockdale Run Formation, Beekmantown Formation, Stonehenge Limestone and Conococheague Formation.",,"Undivided; Appalachian Plateaus and Valley and Ridge.From expanded explanation (ref. VA002):Lower Ordovician and Upper Cambrian Formations undivided; includes Pinesburg Station Dolomite, Rockdale Run Formation, Beekmantown Formation, Stonehenge Limestone, and Conococheague Formation. Refer to descriptions under Ob and O[co/[co.",VA003,limestone,dolostone (dolomite),chert; sandstone,VA001 VA002VA003
VA,Ocg,Ocg,Ocg;0,VAOcg;0,0,,Columbia pluton,Ordovician,Columbia pluton  - Granite,,"Central Virginia Volcanic-Plutonic BeltChanged from Columbia Granite to Columbia Pluton (Karen Hostettler).From expanded explanation (ref. VA002):Columbia pluton. Light-gray, medium- to coarse grained, foliated. Includes biotite-muscovite granite, granodiorite, tonalite, and granitic pegmatite; contains xenoliths of biotite gneiss, amphibolite, and felsic metavolcanic rocks. Mineralogy: plagioclase + quartz + microcline; common accessories include biotite, muscovite, epidote, zircon, apatite, garnet, magnetite, and pyrite (Bourland and Glover, 1979). Geophysical signature: diffuse magnetic lows and radiometric highs. The pluton was originally named Columbia Granite by Jonas (1928); this name was objected to by later workers because of the relatively small percentage of true granite present. The pluton includes the southeastern portion of the granodiorite unit of Smith and others (1964). Granitic rocks in the Carysbrook area of Fluvanna County are here considered part of a separate Carysbrook pluton, following the usage of Stose and Stose (1948). The Columbia includes, in part, the Hatcher complex of Brown (1969). Bourland and Glover (1979) refer to the pluton as the Columbia metagranite. Given the heterogeneous nature of the pluton, multiple intrusive phases are likely present.	 Tonalite in the eastern part of the pluton has yielded ages of 590+/-80 Ma, (Rb-Sr whole-rock; Fullagar, 1971). Mose andNagel (1982) report a Rb-Sr whole-rock age for the Columbia of 454ñ9 Ma. Because samples for this age are described as coming from the western portion of the Columbia, it is possible that the rocks dated were taken from what is herein mapped as the Carysbrook pluton (grc).",VA003,granite,,,VA001 VA002VA003
VA,Oeln,Oeln,Oeln;0,VAOeln;0,0,,"Edinburg Formation, Lincolnshire and New Market Limestones",Ordovician,"Edinburg Formation, Lincolnshire and New Market Limestones - Black limestone and shale; gray limestone, in part cherty",,"Appalachian Plateaus and Valley and Ridge.From expanded explanation (ref. VA002):Edinburg Formation, and Lincolnshire and New Market Limestones (northeast of Roanoke County).Edinburg Formation (Cooper and Cooper, 1946). Limestone and shale. Limestone, dark-gray to black, aphanic, thin-bedded with thin, black shale partings, locally contortedlimestone beds, intraformational limestone breccias, and olistoliths interstratified with typical planar bedded limestone (Liberty Hall lithofacies). Limestone, medium- to light-gray, fine- to coarse-grained, nodular with very thin, black shale partings (Lantz Mills lithofacies). Limestone, light-gray, medium- to coarse-grained, thick-bedded (St Luke Limestone Member). Shale, black, graptolites common, basal unit in Augusta, eastern Rockingham, and southern Page counties. Thickness ranges from 400 feet at Strasburg to approximately 100 feet west of Lexington with a maximum of nearly 1500feet near Harrisonburg.Lincolnshire Limestone (Cooper and Prouty, 1943). Limestone, light- to dark-gray, fine- to coarse-grained, with black chert nodules. Light-gray, coarse-grained limestone probably represents carbonate mounds ( Murat limestone). Upper contact is gradational; the lower contact is disconformable. Thickness ranges from 25 feet west of Front Royal to 280 feet northwest of Lexington (Cooper and Cooper, 1946).New Market Limestone (Cooper and Cooper, 1946). Limestone, medium- to dark-gray, aphanic to fine-grained. The upper portion of the New Market, the major quarry rockof northern Virginia, is massive micrite that weathers to fluted ledges. The lower portion is dolomitic with scattered lenticular, black, pyritic limestone, locally conglomeratic at the base. Upper contact is disconformable and the lower contact is a locally angular unconformity. The thickness ranges from 0 near Staunton to 250 feet west of Edinburg.",VA003,limestone,black shale,chert,VA001 VA002VA003
VA,Okpl,Okpl,Okpl;0,VAOkpl;0,0,,"Knobs Formation, Paperville Shale, Lenoir and Mosheim Limestone",Ordovician,"Knobs Formation, Paperville Shale, Lenoir and Mosheim Limestone - Sandstone, conglomerate, siltstone; black, fissile shale; and limestone, in part cherty.",,"In Fincastle Valley (Botetourt County)  the Knobs Formation represented by Fincastle Conglomerate and Martinsburg Formation; Appalachian Plateaus and Valley and Ridge.From expanded explanation (ref. VA002):Knobs formation, Fincastle Conglomerate Member of the Martinsburg Formation, Paperville Shale, and Lenoir and Mosheim Limestones.Knobs formation (Cooper, 1961). Shale, siltstone, sandstone, and conglomerate. Shale and siltstone, brown. Sandstone, lithic, greenish-brown, fine- to coarse-grained. Conglomerate, polymictic (rounded to subrounded clasts of limestone, dolomite, sandstone, quartzite, vein quartz, shale, chert, and feldspar in calcareous matrix). Some interbeds of calcareous siltstone and sandstone. The Knobs formation ranges from 800 to 3400+ feet in thick ness (the upper part of the unit is eroded) (Bartlett and Biggs, 1980). The Knobs formation corresponds to the upper member of the Athens Shale of Butts (1933) as described by Bartlett and Biggs (1980).Fincastle Conglomerate Member of the Martinsburg Formation.Conglomerate, sandstone, shale, and siltstone (Rader and Gathright, 1986). Conglomerate (type 1), poorly sorted, clast-supported, pebble to boulder clasts of limestone, dolomite,quartzite, sandstone, chert, vein quartz, granite gneiss, quartz pebble conglomerate, greenstone, and shale, subangular to subrounded. Conglomerate (type 2), poorly-sorted, matrix supported clasts of quartzite, vein quartz, limestone, and chert, subrounded to well-rounded. Matrix framework grains in both types are sand-size quartz, limestone, and dolomite with minor chlorite and sericite. The cement is calcite. The conglomeratefines upward from a scoured base to sandstone. Sandstone, lithic, medium- to very-coarse-grained, brownish-gray, cross stratification rare. Shale and siltstone, gray, convolute bedding common. This member is restricted to the Fincastle area of BotetourtCounty.Paperville Shale (Cooper, 1956). Shale, olive-gray to dark-gray, fissile, thin-bedded; with minor gray, argillaceous siltstone, fossiliferous in lower part. The Paperville Shaleranges from 200 to 2300 feet in thickness (Bartlett and Biggs, 1980). The Paperville Shale corresponds to the lower member of the Athens Shale of Butts (1933) as described by Bartlett and Biggs (1980).Lenoir Limestone (Safford and Killibrew, 1876). Limestone, argillaceous, gray to dark-gray, fine-grained, medium bedded, silty laminations, fossiliferous. Lower contact isunconformable. The Lenoir Lime stone ranges from 0 to 70 feet in thickness (Bartlett and Biggs, 1980).Mosheim Limestone (Ulrich, 1911). Limestone, aphanic, medium-bedded with calcite crystal clusters, sparsely fossiliferous; limestone-dolomite-chert clasts in aphanic limestone matrix common at base of unit; rare thin interbedded dolomite. Unconformable with underlying unit. The Mosheim Limestone ranges from 0 to 150 feet in thickness (Bartlett and Biggs, 1980). The Lenoir and Mosheim Limestones have a combinedthickness up to 270 feet in southwestern Washington County (Bartlett and Webb, 1971).In the Fincastle Valley the nomenclature Lincolnshire and New Market Limestones replaces Lenoir and Mosheim Limestones of older reports.",VA003,sandstone,conglomerate,siltstone; black shale; limestone; chert,VA001 VA002VA003
VA,Okq,Okq,Okq;0,VAOkq;0,0,,Arvonia Formation - Kyanite quartzite and schist.,Ordovician,Arvonia Formation - Kyanite quartzite and schist.,,"Central Virginia Volcanic-Plutonic Belt.From expanded explanation (ref. VA002):Kyanite quartzite and schist. White to light-gray, medium- to coarse-grained, well-foliated, locally crinkle-folded, quartzose kyanite schist and kyanite-bearing quartzite. Mineralogy: kyanite + quartz + muscovite ñ graphite ñ pyrite ñ garnet; kyanite constitutes as much as 30 percent of the rock. Kyanite-bearing quartzites and schists have been correlated with quartzose muscovite schists that occur locally at the base of the Arvonia Formation (Conley and Marr, 1980). Those workers report primary sedimentary structures in kyanite quartzite including wedge-shaped quartzite layersand quartzite-metapelite couplets; fining-upward sequences; channel fillings; and, large-and small-scale cross-beds.",VA003,quartzite,schist,,VA001 VA002VA003
VA,Ol,Ol,Ol;0,VAOl;0,0,,Lake Jackson Pluton,Ordovician,Lake Jackson Pluton - Micaceous metatonalite.,,"Western Piedmont, Northern.From expanded explanation (ref. VA002):Lake Jackson pluton (Pavlides, 1990). Mesocratic, fine- to medium-grained, strongly-foliated and locally lineated micaceous metatonalite. Plagioclase shows alteration to fine grained white mica and granular epidote; quartz has commonly been recrystallized into granoblastic- to mosaic-textured aggregates; flattened quartz blebs along with dimensionally-aligned feldspar impart a mineral lineation locally. Biotite, epidote, chlorite, and muscovite define a discontinuous sinuous foliation. Allanite is an accessory mineral that is locally rimmed by epidote.	",VA003,felsic gneiss,,,VA001VA002 VA003
VA,Ola,Ola,Ola;0,VAOla;0,0,,Lahore Complex - Amphibole monzonite,Ordovician,Lahore Complex - Amphibole monzonite,,"Western Piedmont, NorthernFrom expanded explanation (ref. VA002):Amphibole monzonite. Mesocratic, medium-grained, amphibole monzonite and amphibole-quartz monzonite have a foliation defined by alignment of tabular feldspar crystals. Mineralogy includes microcline or orthoclase, intermediate-composition plagioclase, and quartz; mafic minerals are amphibole ranging from common hornblende to edenite, locally rimming pyroxene, subordinate biotite, and magnetite. Epidote, titanite, apatite and allanite are also present.",VA003,monzonite,,,VA001VA002 VA003
VA,Olm,Olm,Olm;0,VAOlm;0,0,,Lahore Complex - Mafic and ultramafic rocks,Ordovician,Lahore Complex - Mafic and ultramafic rocks,,"Western Piedmont, NorthernFrom expanded explanation (ref. VA002):Mafic and ultramafic rocks. Composite mass that consists of partially serpentinized pyroxenite containing diopside rimmed by antigorite or by tremolite.",VA003,metamorphic rock,pyroxenite,,VA001 VA002VA003
VA,Olp,Olp,Olp;0,VAOlp;0,0,,Lahore Complex - Pyroxene monzonite,Ordovician,Lahore Complex - Pyroxene monzonite,,"Western Piedmont, Northern.From expanded explanation (ref. VA002):Pyroxene monzonite. Dark-gray to black, fine- to medium-grained, massive- to indistinctly-foliated; consists of large, locally-twinned augite, poikilitic in part, enclosingapatite, opaque oxide, biotite, and plagioclase. Compositionally-zoned and unzoned plagioclase is also a significant coarse-grained consitituent. This lithology is gradational into amphibole monzonite.",VA003,monzonite,,,VA001 VA002VA003
VA,Ols,Ols,Ols;0,VAOls;0,0,,Moccasin or Bays Formation through Blackford Formation,Ordovician,"Moccasin or Bays Formation through Blackford Formation - Dusky-red shale and mudstone; sandstone; limestone, in part cherty; and calcareous shale.",,"Appalachian Plateaus and Valley and Ridge(Mocassin Formation, Bays Formation, with unnamed  Unit C, Unit B, Unit A from expanded explanation) (Karen Hostettler):From expanded explanation (Ref. VA002):Moccasin Formation, Bays Formation, Unit C, Unit B, and Unit A.Moccasin Formation (Campbell, 1894). Mudstone, shale, imestone, and sandstone. Mudstone and shale, dusky-red to dark-reddish-brown, calcareous, ripple-marks, and mud cracks common. Limestone, light-olive-gray, weathers very-light gray, aphanic with ""birds-eyes"", locally fossiliferous. The limestone generally is the middle member of the Moccasin southwest of Giles County. In eastern Giles County and northeastward a thin medium-grained, gray sandstone occurs near the base of the Moccasin. The thickness ranges from 0 in northern Alleghany County to about 600 feet in Scott County.Bays Formation (Keith, 1895). Siltstone, sandstone, mudstone, and limestone. Siltstone, grayish-red, olive- to light-olive-gray, locally calcareous, sandy in part. Sandstone, light-gray to yellowish-gray, fine- to very-coarse-grained, locally conglomeratic, calcareous. Mudstone, grayish-red, olive- to light-olive-gray, mudcracks common. Limestone, grayish-red to light-olive-gray, aphanic. Five distinct K-bentonites reported by Hergenroder (1966). Contacts are conformable except perhaps in Botetourt, Roanoke, and Montgomery counties. Thickness ranges from 105 feet north of Wythevilleto 890 feet near Daleville in Botetourt County. From Scott and Washington counties to Highland County and northwest of the Pulaski and North Mountain faults, a multitude of stratigraphic names have been applied to the rocks between the Bays or Moccasin (above) and the Beekmantown or Knox (below). The lack of detailed geologic mapping,except in Scott and Giles counties, the restricted area of the two major stratigraphic studies (Cooper and Prouty, 1943; Kay, 1956), and the general disagreement as to mappability and correlation of units makes it impossible to apply specific stratigraphic nomenclature at this time. Therefore, the rocks are described as three packages of lithologies (from youngest to oldest): Unit C, Unit B, and Unit A.Unit C. Limestone, medium- to dark-gray, aphanic to fine-grained with thin, medium- to coarse-grained beds, argillaceous, nodular to planar-bedded, locally very fossiliferous. The following names have been applied to Unit C: Witten, Bowen, Wardell, Gratton, Benbolt, Chatham Hill, Wassum, Rich Valley, Athens, Ottesee, Liberty Hall, Fetzer,and Giesler.Unit B. Limestone, light- to dark-gray, aphanic to coarsegrained, black and gray chert nodules, carbonate mound buildups. This unit is characterized by grainstone with interbedded micrite and chert. The overlying Unit C is very argillaceous and lacks chert. The following names have been applied to Unit B: Wardell, Gratton, Benbolt, Lincolnshire, Big Valley, McGlone, McGraw, Five Oaks, Peery, Ward Cove, Rockdell, Rye Cove, Effna, Whitesburg, Holston, Pearisburg, and Tumbez. Unit A. Dolostone, light- to medium-gray, fine-grained, locally conglomeratic, cherty. Limestone, medium- to dark gray, fine-grained, locally cherty. Shale, light-gray to dusky red. A basal chert-dolomite conglomerate with clasts as much as cobble size is locally present on the unconformity surface. The following names have been applied to Unit A: Blackford, Elway, Tumbez, Lurich (lower part), and ""basal clastics"".",VA003,shale,mudstone,sandstone; limestone; chert,VA001 VA002VA003
VA,Om,Om,Om;0,VAOm;0,0,,Martinsburg and Oranda Formations,Ordovician,"Martinsburg and Oranda Formations - Shale, sandstone, siltstone, and limestone.",,"Appalachian Plateaus and Valley and Ridge.From expanded explanation (ref. VA002):Martinsburg and Oranda Formations.Martinsburg Formation (Geiger and Keith, 1891). Three lithologic packages are recognized in the Martinsburg (in ascending order): black shale and limestone; sandstone and shale; and sandstone (Rader and Biggs, 1976). The lower unit consists of 200 to 250 feet of black calcareous shale, black aphanic, argillaceous limestone; and thin, light-brown K-bentonites. The bulk of the formation, more than 2800 feet, is composed of olive-green to gray, fine- to medium-grained, lithic sandstone and greenish-gray shale and siltstone. These lithologies occur in base-truncated Bouma cycles. Graded bedding, flute casts,and load casts are common. The upper unit, about 170 feet thick, is brownish-gray, medium- to coarse-grained, quartz sandstone. The lower two-thirds of this sandstone contains near-shore, marine fossils.Oranda Formation (Cooper and Cooper, 1946). Limestone and siltstone. Limestone, medium- to dark-gray, fine-grained, very argillaceous. Siltstone, black to dark-gray; bothlithologies silicified where in contact with a K-bentonite. Five K-bentonites identified in the type section (Rader and Read, 1989).",VA003,shale,sandstone,siltstone; limestone,VA001VA002 VA003
VA,Omk,Omk,Omk;0,VAOmk;0,0,,Mascot and Kingsport Dolomites,Ordovician,"Mascot and Kingsport Dolomites - Dolomite, chert, and minor limestone.",,"Appalachian Plateaus and Valley and Ridge.From expanded explanation (ref. VA002):Mascot and Kingsport Dolomites.Mascot Dolomite (Rodgers, 1943). Dolostone and limestone. Dolostone, nearly white or very-light- to medium gray with red- to pink-streaks, very-fine- to fine-grained; withsubordinate medium- to coarse-grained dolostone; thin green shale partings; sandstone lenses to 1-foot thick; and grayish red and dark-gray dolostones; all locally present. Dense, gray limestone is in the lower half and chert is present locally. Unconformable (locally angular) upper contact. The Mascot Dolomite ranges from 330 to 640 feet in thickness. Kingsport Dolomite (Rodgers, 1943). Dolostone and limestone. Dolostone, very-light-gray to dark-gray and light- to dark-brown, fine- to coarse-grained; with white chert; thin green shale partings; sandstone lenses; and scattered sand grains. Fine-grained limestone is locally present. The Kingsport Dolostone ranges from 100 to 350 feet in thickness. The Longview Limestone of previous reports is included in the Kingsport (Harris, 1969).",VA003,dolostone (dolomite),chert,limestone,VA001 VA002VA003
VA,Oml,Oml,Oml;0,VAOml;0,0,,Hardy Creek Limestone through Dot Limestone,Ordovician,"Hardy Creek Limestone through Dot Limestone - Limestone, in part cherty; and calcareous shale.  Includes Hardy Creek, Ben Hur, Woodway, Hurricane Bridge, Martin Creek, Rob Camp, Poteet, and Dot Limestones.",,"Appalachian Plateaus and Valley and Ridge.From exapnded explanation (ref. VA002):Hardy Creek, Ben Hur, Woodway, Hurricane Bridge, Martin Creek, Rob Camp, Poteet, and Dot Limestones (Lee County).Hardy Creek Limestone (Miller and Fuller, 1947). Limestone, light-olive-gray to olive-gray, light- to medium-gray, and brown, micrograined, 1- to 2-inch-thick beds, even-bedded; with interbedded yellowish-gray, argillaceous, limestone; and light-olive-gray, aphanic limestone. Olive-black chert nodules locally abundant. The Hardy Creek Limestone ranges from 75 to 150 feet in thickness.Ben Hur Limestone (Miller and Brosg, 1950). Limestone, argillaceous, yellowish-gray, light-olive-gray, light-brown, and light-gray, micrograined, thin-bedded; some beds composed of fossil detritus in middle of unit; and some beds of coarsegrained imestone. The Ben Hur Limestone ranges from 95 to 165 feet in thickness.Woodway Limestone (Miller and Brosg, 1950). Limestone, light-olive-gray to olive-gray and light-brownish-gray to brownish-gray, micrograined, thin-bedded, even-bedded;interbedded with olive-gray to olive-black, medium-grained, wavy-bedded limestone; and sparse zones of argillaceous limestone. Thin limestone beds composed of fossils locallyabundant at base of unit. Locally abundant olive-black chert nodules. The Woodway Limestone ranges from 240 to 400 feet in thickness.Hurricane Bridge Limestone (Miller and Brosg, 1950). Limestone, light-gray and light-olive-gray to olive-gray, thin-bedded, micrograined, yellowish-gray; with intervals of interbedded grayish-red, argillaceous, micrograined limestone; and light-olive-gray, thick-bedded, micrograined limestone. Dark-gray chert zones locally present. The Hurricane Bridge Limestone ranges from 200 to 370 feet in thickness.Martin Creek Limestone (Miller and Brosg, 1950). Limestone, light-olive-gray to dark-olive-gray, locally with abundant fossil fragments, me ium-grained; and light-olive gray to dark-olive-gray, micrograined limestone; with locally abundant olive-black chert nodules. A fine- to coarse-grained limestone that is a maximum 35 feet thick is locally present. Locally the dark colored, medium-grained limestone emits a petroliferous odor when broken. The Martin Creek Limestone ranges from 40 to 180 feet in thickness.Rob Camp Limestone (Miller and Brosg, 1950). Limestone, light-olive-gray, thin- to massive-bedded, micrograined, with patches of white calcite (""birds-eyes"") and very sparse chert nodules. The Rob Camp Limestone ranges from discontinuous (where cut out by post-depositional erosion) to a maximum 150 feet in thickness (Miller and Brosg, 1954).Poteet Limestone (Miller and Brosg, 1950). Limestone, grades from light-olive-gray and medium-gray, micrograined limestone; interbedded with argillaceous, yellowish-gray, micrograined limestone in the southwest; to dark-gray, medium grained limestone; overlain by interbedded light-olive-gray, micrograined limestone, and argillaceous limestone in the northeast. Locally abundant olive-black chert nodules. Generallythin- to medium-bedded. The Poteet Limestone ranges from 45 to 110 feet in thickness.Dot Limestone (Miller and Brosg, 1950). Limestone, dolomite, and shale. Limestone, light-olive-gray, micrograined, thin- to medium-bedded, locally dolomitic. Dolostone, argillaceous, conglomeratic (pebbles and cobbles derived from underlying dolomite and chert), grayish-red, yellowish-gray, and very-light- to medium-gray, micro-grained, grades into overlying limestone. Shale, dolomitic to calcareous, very light-to light-gray, interbedded with limestone and dolomite beds. One or more chert zones may be locally present near top of unit. Generally lower contact is represented by an unconformity overlain by the conglomeratic dolomites. The Dot Limestone ranges from 70 to 220 feet in thickness.",VA003,limestone,shale,chert,VA001VA002 VA003
VA,Oq,Oq,Oq;0,VAOq;0,0,,Quantico Formation - Slate and porphyroblastic schist,Ordovician,Quantico Formation - Slate and porphyroblastic schist,,"Central Virginia Volcanic-Plutonic Belt.From expanded explanation (ref. VA002):Slate and porphyroblastic schist. Gray to black, graphitic, pyritic phyllite and slate (northern Piedmont); metamorphic grade increases to the southwest to produce porphyroblastic staurolite-, kyanite-, and garnet-biotite muscovite schists. Locally the unit contains felsic metatuff, metagraywacke, and micaceous quartzite interbeds; thickness has been estimated at as much as 3000 feet (Pavlides, 1980).Mineralogy: quartz + muscovite + biotite ñ garnet ñ staurolite ñ kyanite + opaque minerals; chlorite is a common secondary mineral. Geophysical signature: strike-elongated positive linear magnetic and radiometric anomalies. The unit was originally named Quantico Slate by Darton (1894), and modified to Quantico Formation by Pavlides (1980). An Ordovician age for the Quantico is indicated by fossils collected by Watson and Powell (1911) and more recently by Pavlides and others (1980). The Quantico unconformably overlies older units in the northeastern Pied mont, and is correlated with the Arvonia Formation to the southwest.	",VA003,slate,schist,,VA001VA002VA003
VA,Oqq,Oqq,Oqq;0,VAOqq;0,0,,Quantico Formation - Micaceous quartzite,Ordovician,Quantico Formation - Micaceous quartzite,,"Central Virginia Volcanic-Plutonic Belt. From expanded explanation (ref. VA002):Micaceous quartzite. Light-gray, fine- to medium grained quartzite and quartzose muscovite schist. Mineralogy: quartz + muscovite + plagioclase ñ microcline. This lithology occurs as thin discontinuous lenses at the base of the Quantico; thin diopsidic calcsilicate layers are also found locally in the lower part of the Quantico (Pavlides, 1980).",VA003,quartzite,schist,,VA001 VA002VA003
