STATE,ORIG_LABEL,MAP_SYM1,MAP_SYM2,UNIT_LINK,PROV_NO,PROVINCE,UNIT_NAME,UNIT_AGE,UNITDESC,STRAT_UNIT,UNIT_COM,MAP_REF,ROCKTYPE1,ROCKTYPE2,ROCKTYPE3,UNIT_REF
VA,rbg,rbg,rbg;0,VArbg;0,0,,Biotite Gneiss,Proterozoic,Biotite gneiss,,"Southeastern PiedmontFrom expanded explanation (ref. VA002):Biotite gneiss. Light-gray, medium- to coarse grained, compositionally-layered and locally migmatitic rocks, include interlayered biotite gneiss, muscovite-biotite gneiss, muscovite-biotite schist, and sillimanite-mica schist; also includes minor interlayers and lenses of granitic gneiss, biotite-amphibole gneiss, amphibolite, garnet-mica schist, calc-silicate granofels, and rare ultramafic rocks. This unit correlates with Raleigh belt rocks in North Carolina (Parker, 1979; Geologic Map of North Carolina, 1985).",VA003,biotite gneiss,,,VA001VA002VA003
VA,ro,ro,ro;0,VAro;0,0,,Red Oak Pluton,Proterozoic,Red Oak pluton - Granite,,"Carolina Slate BeltName changed from Red Oak Granite to Red Oak Pluton by Karen HostettlerFrom expanded explanation (ref. VA002):Red Oak pluton. Light-gray, medium-grained, foliated granite to granodiorite. Mineralogy: quartz + potassium feldspar + plagioclase + biotite; accessory minerals include muscovite, apatite, and zircon. Hydrothermal alteration to sericite, epidote, kaolin, and chlorite is common. Geophysical signature: positive radiometric anomaly. This unit is equivalent in part to the Red Oak granite as defined by Laney (1917) and Horton and others (1993).",VA003,granite,,,VA001VA002VA003
VA,sb,sb,sb;0,VAsb;0,0,,Beach Sand and Dune Sand Deposits,Quaternary,"Beach Sand and Dune Sand Deposits - Fine- to coarse-grained quartz sand, poorly to well-sorted.",,"Coastal PlainAdded Holocene Epoch to age table (Karen Hostettler)From expanded explanation (ref. VA002):Sand (Holocene). Pale-gray to light-yellowish gray, fine to coarse, poorly sorted to well-sorted, shelly in part; contains angular to rounded fragments and whole valves of mollusks. Comprises deposits of coastal barrier islands and narrow beach dune ridges bordering brackish-water marshes of Chesapeake Bay. Thickness is as much as 40 feet.",VA003,beach sand,dune sand,,VA001VA002VA003
VA,sch,sch,sch;0,VAsch;0,0,,Schist,Proterozoic,Schist as exotic blocks within melange units,,Western Piedmont,VA003,schist,,,VA001VA003
VA,Sf,Sf,Sf;0,VASf;0,0,,Falls Run Granite Gneiss,Silurian,Falls Run Granite Gneiss - Granite,,"Cental Virginia Volcanic-Plutonic Belt, Eastern Piedmont.From expanded explanation (ref. VA002):Falls Run Granite Gneiss (Pavlides, 1980). Pink to white, coarse-grained, strongly-foliated hornblende-biotite granite to monzonite gneiss. Mineralogy: microcline + plagioclase + quartz + biotite + muscovite ñ hornblende; apatite, epidote, titanite, and magnetite-ilmenite are accessories; myrmekite is common. The Falls Run has been dated at 410 Ma (U-Pb zircon and Rb-Sr whole-rock; Pavlides and others, 1982); the gneiss intrudes Ta River Metamorphic Suite (Cta) and the Holly Corners Gneiss (CZh).",VA003,granite,,,VA001VA002VA003
VA,Shrc,Shrc,Shrc;0,VAShrc;0,0,,"Hancock, Rose Hill, and Clinch Formations",Silurian,"Hancock, Rose Hill, and Clinch Formations - Limestone and dolomite; dusky-red and green shale and sandstone; and sandstone, shale and conglomerate.",,"Appalachian Plateaus and Valley and Ridge.From expanded explanation (ref. VA002):Hancock, Rose Hill, and Clinch Formations.Hancock Formation (Keith, 1896). Dolomite, limestone, and sandstone. Dolomite, locally calcareous, locally siliceous, light-olive-gray and light-to dark-gray, aphanic to fine-grained, finely-laminated to massive-bedded, locally stromatolitic and vuggy. Lime stone, medium- to dark-gray and bluish-gray, aphanic to fine-grained, laminated to thickbedded, ribbon-banded, mottled, locally emits petroliferous odor when broken. Sandstone, locally calcareous, generally quartzose, medium-grained to pebbly and conglomeratic locally at base of formation; and fine- to medium-grained sandstonelocally interbedded with limestone. The formation grades from dolomite with minor limestone and a basal sandstone in southwestern Lee County (Cayuga Dolomite of Miller and Fuller, 1954) to limestone with an underlying or interbedded dolomite with sandstone partings, and a basal sandstone to the northeast and east (Harris and Miller, 1958; Miller and Roen, 1971). The Hancock Formation ranges from 75 to 225 feet in thickness and correlates with the Tonoloway Limestone. Rose Hill Formation . Refer to description under Skrt.Clinch Formation (Safford, 1856). Quartzarenite and shale. Quartzarenite, very-light gray, olive-gray, and brownish- gray with local grayish-red beds, very-fine-grained tovery-coarse-grained with local conglomeratic zones, thin- to thick-bedded with thin, green ish-gray and dark-gray shale beds and partings in upper part. Shale, light-olive-gray togray ish-green; with thin, very fine- to fine-grained sandstone interbeds in the lower one-third to one-quarter of the unit. Erosional unconformity at base of unit identified in northern Lee County (Mill er and Roen, 1973). The Clinch Formation ranges from 220 to 330 feet in thickness.The Division of Mineral Resources uses the name Clinch Formation for exposures in Lee, Wise, and Scott counties where the lower Silurian rocks include the lower Hagan ShaleMember and the upper Poor Valley Ridge Sand stone Member. The name Tuscarora Formation is used for the lower Silurianquartzitic sandstone unit in all areas northward in the Valley and Ridge of Virginia, including the Clinch Mountain area where the name Clinch Formation was first used, because of similarity between the Tuscarora and the rocks on Clinch Mountain. In the past many geologists used the name Clinch Sandstone in the southern part of the Valley and Ridge of Virginia and the name Tuscarora Formation in the northern part of the Valley and Ridge of Virginia (Butts, 1940) for essentially the same group of quartzitic sandstones. Dennison and Boucot (1974) and Mill er (1976) described the facies change of the lower Silurian Clinch Sandstone of Southwest Virginia from quartzitic sandstones in the Clinch Mountain belt in Scott and Wise Counties to sandstones and shales in the Lee, southwestern Wise, and western Scott counties area.",VA003,shale,siltstone,sandstone; dolostone (dolomite); limestone; conglomerate,VA001VA002VA003
VA,Skrt,Skrt,Skrt;0,VASkrt;0,0,,"Keefer, Rose Hill, and Tuscarora Formations",Silurian,"Keefer, Rose Hill, and Tuscarora Formations - Quartzarenite, dusky-red shale, and sandstone, Some landslides with intact stratigraphic units in Craig County area..",,"Appalachian Plateaus and Valley and Ridge.From expanded explanation (ref. VA002):Keefer Sandstone, and Rose Hill and Tuscarora Formations.Keefer Sandstone (Ulrich, 1911). Sandstone, light-gray, fine-grained, cross-laminated, medium-bedded, very resistant. Thins northward and southwestward from a maximum of over 300 feet in Craig and western Botetourt counties. To the north it appears to interfinger with the Wills Creek and McKenzie Formations. The Keefer is equivalent to the upper portion of the Massanutten Sandstone. (The Keefer Sandstone, as usedin this report, includes all of the quartzarenites with minor Skolithus-bearing red sand stone and minor calcite cemented quartzarenite in the interval above the Rose Hill Formation and below the Tonoloway Limestone in Botetourt, Rockbridge, andAugusta counties between Eagle Rock and Augusta Springs (Lampiris, 1976). Rose Hill Formation (Swartz, 1923). Sandstone, dark grayish-red, fine- to coarse-grained, poorly-sorted, argillaceous; hematite cemented, quartz sandstone interbedded with red or yellowish-green clay shale and greenish-gray, fine-grained sandstone. It is largely siltstone and shale with minor sandstone and thin limonitic iron ore beds in SouthwestVirginia. Conformable with the underlying Tuscarora Formation, the Rose Hill Formation ranges up to 500 feet in thickness in northern and western Virginia but pinches-outin southwest ern Botetourt and Roanoke counties where the Keefer and Tuscarora For ma tions merge. It is present with other Silurian rocks everywhere except in the Massanutten Mountains or where an unconformity exists in exposures eastof Walker Mountain.Tuscarora Formation (Darton and Taff, 1896). Quartzite, quartzarenite, and minor shale. Quartzite, light-gray with few nearly white, porcelaneous beds, fine- to medium-grained,with quartz-pebble conglomerate locally near base, quartz cemented, thick-bedded, and cross-bedded, resistant, cliff- and ledge-former, generally not more than 75 feet thick, comprises entire unit in many areas or is upper member where unconformably overlying a lower quartzarenite and shale member. Quartzarenite, light-yellowish-brown or medium-gray, fine-grained, thin-bedded, ranges in thickness from 0 to 175feet. Shale, light- to medium-brownish-gray, arenaceous, thin interbeds in quartzarenite. Conformably overlies the Juniata Formation in central western Virginia. Where lower member is absent the upper member unconformably overlies the Juniata, Oswego, Martinsburg, or Reedsville Formations or may be conformable with the Juniata Formation in northern Virginia. In southwestern Virginia grayish-red, fine-grained,ferruginous sandstone with lenses of coarse-grained, quartz sandstone and quartz-pebble conglomerate are included in the upper part of the formation. The Tuscarora is equivalent to the Clinch Formation and to the lower part of the Massanutten Sandstone.",VA003,arenite,shale,sandstone,VA001VA002VA003
VA,Sm,Sm,Sm;0,VASm;0,0,,Massanutten Sandstone,Silurian,Massanutten Sandstone - Quartzarenite with lenses of conglomerate.,,"Appalachian Plateaus and Valley and Ridge.From expanded explanation (ref. VA002):Massanutten Sandstone (Geiger and Keith, 1891).Quartzite and sandstone, very-light-gray, fine-grained, well-sorted, locally conglomeratic, thick-bedded and crossbedded, very resistant with minor shale partings in upper part. Thickness ranges from 600 to nearly 1200 feet. Present only in the Massanutten Mountains, the sandstone unconformably overlies the Martinsburg Formation and is a lateral equivalent to the Tuscarora, and Rose Hill Formations, and Keefer Sandstone (Perry, 1977).",VA003,arenite,quartzite,conglomerate,VA001VA002VA003
VA,SOe,SOe,SOe;0,VASOe;0,0,,Ellisville Biotite Granodiorite,Ordovician-Silurian,Ellisville Biotite Granodiorite - Biotite granodiorite,,"Western Piedmont, Northern. From expanded explanation (ref. VA002):Ellisville biotite granodiorite (Pavlides, 1990). Mesocratic, coarse- to medium-grained, equigranular to porphyritic, massive to strongly foliated granodiorite. Mineralogy: quartz + plagioclase + potassium feldspar + biotite; accessories include epidote, allanite, titanite, and apatite. Porphyritic rocks contain potassium feldspar megacrysts up to 1.5 cm across; myrmekite commonly occurs adjacent to potassium feldspar. Brownish-green, strongly pleochroic biotite is associated with, and in places poikilitically encloses epidote, allanite, titanite, and apatite. Subhedral epidote locally encloses euhedral titanite. Pleochroic green amphibole and muscovite are minor constituents locally. The Ellisville has been dated at 440ñ8 Ma (Rb-Sr whole rock; Pavlides and others, 1982).",VA003,granodiorite,,,VA001VA002VA003
VA,SOz,SOz,SOz;0,VASOz;0,0,,Silurian and Upper Ordovician Formations Undivided,Ordovician-Silurian,"Silurian and Upper Ordovician Formations Undivided - Includes: Skrt, Sm, Oun, Ous, Ou, Om. (Shrc and Okpl?)",,Undivided; Appalachian Plateaus and Valley and Ridge,VA003,sandstone,shale,siltstone; limestone; mudstone; quartzite; arenite,VA001VA003
VA,sp,sp,sp;0,VAsp;0,0,,Swamp Deposits,Quaternary,"Swamp Deposits - Peat, mud, and sand.",,Coastal PlainAdded Holocene Epoch to age table (Karen Hostettler),VA003,peat,clay or mud,sand,VA001VA003
VA,Sz,Sz,Sz;0,VASz;0,0,,Silurian Formations Undivided,Silurian,"Silurian Formations Undivided - Some landslides with intact stratigraphic units in Giles County area. Includes: Dsu, Skrt, Sm. (Shrc?)",,Undivided; Appalachian Plateaus and Valley and Ridge,VA003,sandstone,shale,limestone; arenite; conglomerate,VA001VA003
VA,Tb1,Tb1,Tb1;0,VATb1;0,0,,Bacons Castle Formation,Tertiary,Bacons Castle Formation - Gravel grading upward into sand and sandy clayey silt,,"Coastal PlainFrom expanded explanation (ref. VA002):Tb1 / Tb2 Bacons Castle Formation (upper Pliocene, Coch, 1965). Gray, yellowish-orange, and reddish-brown sand, gravel, silt, and clay; constitutes surficial deposits of high plain extending from Richmond, eastward to the Surry scarp. Unit is subdivided into two members: Tb1, massive to thick-bedded pebble and cobble gravel grading upward into cross-bedded, pebbly sand and sandy and clayey silt, and Tb2, predominantly thin-bedded and laminated clayey silt and silty fine-grainedsand. Tb2 is characterized by flaser, wavy, and lenticular bedding and rare to common clay-lined burrows including Ophiomorpha nodosa. Thickness is 0 to 70 feet.",VA003,gravel,sand,silt; clay or mud,VA001VA002VA003
VA,Tb2,Tb2,Tb2;0,VATb2;0,0,,Bacons Castle Formation,Tertiary,Bacons Castle Formation - Poorly sorted sand and laminated sand; clay and silt.,,"Coastal PlainFrom expanded explanation (ref. VA002):Tb1 / Tb2 Bacons Castle Formation (upper Pliocene, Coch, 1965). Gray, yellowish-orange, and reddish-brown sand, gravel, silt, and clay; constitutes surficial deposits of high plain extending from Richmond, eastward to the Surry scarp. Unit is subdivided into two members: Tb1, massive to thick-bedded pebble and cobble gravel grading upward into cross-bedded, pebbly sand and sandy and clayey silt, and Tb2, predominantly thin-bedded and laminated clayey silt and silty fi ne-grainedsand. Tb2 is characterized by flaser, wavy, and lenticular bedding and rare to common clay-lined burrows including Ophiomorpha nodosa. Thickness is 0 to 70 feet.",VA003,sand,clay or mud,silt,VA001VA002VA003
VA,Tc,Tc,Tc;0,VATc;0,0,,Chesapeake Group,Tertiary,"Chesapeake Group - Fine- to coarse-grained sand, silt, clay; variably shelly and diatomaceous",,"May include the following fomations - Chowan River, Yorktown, Eastover, St. Marys, Choptank, and Calvert; Coastal PlainFrom expanded explanation (ref. VA002):Chesapeake Group (upper Pliocene to lower Miocene,Darton, 1891). Fine-to coarse-grained, quartzose sand, silt, and clay; variably shelly and diatomaceous, deposited mainly in shallow, inner- and middle-shelf waters. Ages of units based on studies of foraminiferal, nannofossil, diatom, and moluscan assemblages in Virginia and adjacent states (Andrews, 1988; Gibson, 1983; Gibson and others, 1980; Poag, 1989; Ward and Blackwelder, 1980; Ward and Krafft, 1984). Includes the following formations, from youngest to oldest:Chowan River Formation (upper Pliocene, Blackwelder, 1981). Gray to dusky-blue-green sand, fine- to medium-grained, clayey and silty, commonly very shelly; grades laterally into laminated, silty clay and upward into cross-bedded, biofragmentalsand, clayey silt, and silty clay. Discontinuous pebbly to bouldery sand at very irregular base of unit. Mollusks include Glycymeris hummi, Noetia carolinensis, and Carolinapecten eboreus bertiensis. Thickness is 0 to 50 feet. Recognized only in southeasternmost Virginia and North Carolina.Yorktown Formation (lower upper Pliocene to lower Pliocene, Clark and Miller, 1906). Bluish-gray and brownish-yellow sand, fine- to coarse-grained, in part glauconitic and phosphatic, commonly very shelly, interbedded with sandy and silty blue-gray clay. In lower York and James River basins, unit includes cross-bedded shell hash. Mollusks in clude Glycymeris subovata, Chesapecten jeffersonius, Chesapecten madisonius, Mercenaria tridacnoides, Panopea reflexa. Coarse-grained sand and gravel facies of the Yorktown in updip areas is mapped separately as unit psg. Thickness is 0to 150 feet.Eastover Formation (upper Miocene, Ward and Blackwelder, 1980). Dark-gray to bluish-gray, muddy sand, very fine to fine, micaceous, interbedded with sandy silt and clay. Lower part of unit is dominantly medium- to very-thin-bedded and laminated silt and clay interbedded with very-fine sand, lenticular and wavy bedding common; upper part is mainly very-fine- to fine-grained sand containing abundant clay laminae. Typical mol lusks include Chesapecten middlesexensis, Marvacrassatella surryensis, Glossus fraterna. Thickness is 0 to 270 feet.St. Marys Formation (upper and middle Miocene, Shattuck, 1902). Bluish- to pinkish-gray, muddy, very-fine sand and sandy clay-silt, locally abundantly shelly. Chesapecten santamaria, Buccinofusus parilis, and Ecphora gardnerae are characteristic mollusks. Occurs northeast of Mattaponi River. Thickness is 0 to 40 feet.Choptank Formation (middle Miocene, Shattuck, 1902). Olive-gray sand, fine to very-fine, clayey and silty, shelly, and diatomaceous clay-silt; common y forms fining-upward sequences. Mollusks include Chesapecten nefrens, Mercenaria cuneata, Ecphora meganae. Thickness is 0 to 50 feet.Calvert Formation (middle and lower Miocene, Shattuck, 1902). Commonly consists of 2 to 7 fining-upward sequences. Each sequence includes a light- to dark-olive-gray basal sand, very fine to fine, clayey and silty, very sparsely to abundantly shelly; grades upward to sandy, diatomaceous clay-silt and diatomite. Typical molluscs include Chesapecten coccymelus, Crassatella melinus, Ecphora tricostata. Thickness is 0 to 600feet.",VA003,sand,silt,clay or mud,VA001VA002VA003
VA,td,td,td;0,VAtd;0,0,,Terrace Deposits,Tertiary,"Terrace Deposits - Poorly sorted clay, sand, and rounded pebbles and cobbles, deeply weathered",,Coastal Plain,VA003,terrace,clay or mud,sand; gravel,VA001VA003
VA,Tl,Tl,Tl;0,VATl;0,0,,Lower Tertiary Deposits,Tertiary,"Lower Tertiary Deposits - Glauconitic quartz sand and clay-silt, shelly in part, minor sandy limestone and limey sand; may include the following formations: Brightseat, Aquia, Marlboro, Nanjemay, and Piney Point (Pamunkey Group); and Old Church.",,"May include the following formation - Brightseat, Aquia, Marlboro, Nanjemoy, and Piney Point (Pamunkey Group), and Old Church; Coastal PlainFrom expanded explanation (ref. VA002):Lower Tertiary deposits (Oligocene, Eocene, and Paleocene). Mostly fine- to coarse-grained glauconitic quartz sand and clay-silt, shelly in part; includes lesser amounts of sandy limestone and limey sand. In outcrop, unit comprises the Pamunkey Group (Brightseat, Aquia, Marlboro, Nanjemoy, and Piney Point Formations) and the Old Church Formation. In subsurface, unit includes Eocene and Oligocene strata notincluded in the Pamunkey and Old Church. Ages of formational units based on foraminiferal, nannofossil, dinocyst, pollen, and molluscan studies (Frederiksen, 1979; Gibson and others, 1980; Gibson and Bybell, 1984; Edwards, 1984, 1989; Edwardsand others, 1984; Poag, 1989; Ward, 1985; Ward and Krafft, 1984). Stratigraphic sections vary widely, comprising one or more of the following formations:Old Church Formation (Ward, 1985) and unnamed glauconitic sands (upper Oligocene). In inner and middle Coastal Plain, unit is 0 to 5 feet of olive-gray, fine- to coarse-grained, shelly, very sparsely glauconitic quartz sand of the Old Church Formation; typical fossils include Anomia ruffini, Lucina sp., and Mercenaria capax. In subsurface of outer Coastal Plain, unit includes about 45 feet of dark-olive-gray to greenish black glauconite sand with lesser amounts of quartz; sand has olive-brown clay-silt matrix.Lower Oligocene beds. Olive-gray to grayish-olive sand, very-fine-grained, clayey and silty, micaceous, glauconitic; coarsens upward to a very-fine- to fine-grained sand. Unitis 0 to 50 feet thick; identified only in subsurface of Eastern Shore area (Exmore, core hole, R. B. Mixon and D. S. Powars, personal communication).Chickahominy Formation (upper Eocene, Cushman and Cederstrom, 1945). Predominantly olive-gray clayey silt and silty clay, very compact, glauconitic, micaceous, contains abundant finely crystalline iron sulfide. Coarsens downward to a very-fine- to fine-grained sand, pebbles at base. Rare fragmental shell, microfossils very abundant. Thickness is 0 to 100 feet; present in subsurface of southeastern Virginia.Piney Point Formation (middle Eocene, Otton, 1955). Olive-gray and grayish-olive-green, glauconitic quartz sand, medium-to coarse-grained, poorly sorted, contains scatteredquartz pebbles, interbedded with carbonate-cemented sand and moldic limestone. Unit is characterized by large, calcitic shells of the oyster Cubitostrea sellaeformis, a middle Eocene marker. Aragonitic mollusks are generally leached, leaving only molds and casts. Thickness is 0 to 60 feet.Nanjemoy Formation (lower Eocene, Clark and Martin,1901). Dark-olive-gray, greenish-gray, and olive-black glauconitic quartz sand, fine- to coarse-grained, very clayey and silty, intensely burrowed, sparsely to abundantly shelly, interbedded with sandy clay-silt. Sand in upper part of unit is less clayey, very micaceous, and contains scattered quartz pebbles. Typical mollusks include Venericardia potapacoensis, Venericardia ascia, and Macrocallista subimpressa. Unit is 0 to 140 feet thick.Marlboro Clay (lower Eocene (?) and upper Paleocene, Clark and Martin, 1901). Light-gray, pinkish-gray, and reddish- brown kaolinitic clay, massively bedded to laminated, interbedded with lesser amounts of laminated and ripple cross-laminatedsilt and very-fine-grained sand. Contains rare molds of small mollusks and arenaceous foraminifera. Thickness is 0 to 30 feet.Aquia Formation (upper Paleocene, Clark and Martin, 1901). Light- to dark-olive gray, glauconitic quartz sand, fine- to coarse-grained, clayey and silty, thick- to massivelybedded, sparsely to abundantly shelly. Lower part of unit is more poorly sorted and more calcarious than upper part and contains a few thin to medium beds of olive-gray, white, and pale greenish-yellow limestone. Upper part of unit is moderately well sorted and characterized by thin beds of the large, high-spired gastropod Turritella mortoni. Other common mollusks in clude Cucullaea gigantea, Ostrea sinuosa, and Crassatellites alaeformis. Thickness is 0 to 130 feet.Brightseat Formation (lower Paleocene, Bennett and Collins, 1952). Olive-gray to olive-black, micaceous quartz sand, fine- to very fine-grained, clayey and silty, variably glauconitic. Thickness is 0 to 20 feet.",VA003,sand,silt,limestone,VA001VA002VA003
VA,Tm,Tm,Tm;0,VATm;0,0,,Moorings Unit of Oaks and Coch (1973),Tertiary,"Moorings Unit of Oaks and Coch (1973) - Sand, silt, and clay; at altitudes from 100-130 ft. (top of unit).",,"Coastal PlainFrom expanded explanation (ref. VA002):Moorings unit of Oaks and Coch (1973) (upper Pliocene). White, light-gray, and grayish-yellow quartzose sand and gray to grayish-brown clayey silt and silty clay. Constitutes discontinuous linear body along and just west of the Surry scarp; depositional surfaces range in altitiude from 130 feet along slightly higher, ridge-like topography at scarp to about 110 feet west of scarp. Eastern facies of unit is unfossiliferous, massive to cross-laminated, moderately well-sorted, fine sand believed to have been deposited in beach and near-shore environments. Upper part of fine sand facies interfingers westward with massive, bioturbated clay and silt deposited in a lagoonor shallow bay. Thickness is as much as 30 feet.",VA003,sand,silt,clay or mud,VA001VA002VA003
VA,TRbr,TRbr,TRbr;0,VATRbr;0,0,,"Newark Supergroup; Breccia, mixed clasts",Upper Triassic,"Breccia, mixed clasts",,"Newark Supergroup; Mesozoic Basins.  Paper map and digital map have differernt labels:  paper map does not have TR prefix, but the digital source has TR as part of the label.From expanded explanation (ref. VA002):Breccia, mixed clasts. Angular to subangular pebbles, cobbles, and boulders of mixed lithologies in a reddish-brown matrix of indurated medium- to coarse-grained sandstone.",VA003,breccia,,,VA001VA002VA003
VA,TRbr1,TRbr1,TRbr1;0,VATRbr1;0,0,,"Newark Supergroup; Breccia, mudstone clasts",Upper Triassic,"Breccia, mudstone clasts",,"Newark Supergroup; Mesozoic Basins.  Paper map and digital map have differernt labels:  paper map does not have TR prefix, but the digital source has TR as part of the label.From expanded explanation (ref. VA002):Breccia, mudstone clasts. Angular to subangular pebbles and cobbles of pre dominantly mudstone in a siliceous cemented sandstone. Occurs only in the Scottsville basin.",VA003,sedimentary breccia,,,VA001VA002VA003
VA,TRc,TRc,TRc;0,VATRc;0,0,,"Newark Supergroup; Conglomerate, mixed clasts",Upper Triassic,"Conglomerate, mixed clasts",,"Newark Supergroup; Mesozoic Basins. Paper map and digital map have differernt labels:  paper map does not have TR prefix, but the digital source has TR as part of the label. From expanded explanation (ref. VA002):Conglomerate, mixed clasts. Rounded to subangular pebbles, cobbles, and boulders of mixed lithologies including quartz, phyllite, quartzite, gneiss, schist, greenstone, andmarble in a matrix of medium- to very-coarse-grained, reddish-brown to gray, locally arkosic, sandstone.",VA003,conglomerate,,,VA001VA002VA003
